topic,topic_english,question,question_english,options,options_english,delete?
お寿司,Sushi,「お寿司は日本の食文化の象徴だと考えますか？」,"""Do you think sushi is a symbol of Japanese food culture?""","{'はい': 'supports', 'いいえ': 'opposes'}","{'Yes': 'supports', 'No': 'opposes'}",
お寿司,Sushi,お寿司は世界中で評価されていると思いますか？,Do you think sushi is appreciated all over the world?,"{'はい': 'supports', 'いいえ': 'opposes'}","{'Yes': 'supports', 'No': 'opposes'}",
お寿司,Sushi,新鮮な魚介類と酢飯の組み合わせが最高のお寿司だと信じますか？,Do you believe that the combination of fresh seafood and vinegared rice makes the best sushi?,"{'はい': 'supports', 'いいえ': 'opposes'}","{'Yes': 'supports', 'No': 'opposes'}",
お寿司,Sushi,「お寿司は日本の特徴的な食事だと考えますか？」,"""Do you consider sushi as a characteristic meal of Japan?""","{'はい': 'supports', 'いいえ': 'opposes'}","{'Yes': 'supports', 'No': 'opposes'}",
お寿司,Sushi,お寿司は美味しいと思いますか？,Do you think sushi is delicious?,"{'はい': 'supports', 'いいえ': 'opposes'}","{'Yes': 'supports', 'No': 'opposes'}",TRUE
侍,Samurai,侍の精神を学ぶことは、自己啓発に役立つと思いますか？,Do you think learning the spirit of a samurai is useful for self-improvement?,"{'はい': 'supports', 'いいえ': 'opposes'}","{'Yes': 'supports', 'No': 'opposes'}",
侍,Samurai,現代の日本人に対して、侍の生活様式や思想は影響を及ぼしていますか？,Does the lifestyle and philosophy of samurais influence modern Japanese people?,"{'はい': 'supports', 'いいえ': 'opposes'}","{'Yes': 'supports', 'No': 'opposes'}",
侍,Samurai,侍の武士道精神は、現代社会で重要な価値観と見なされますか？,Is the samurai's bushido spirit considered an important value in modern society?,"{'はい': 'supports', 'いいえ': 'opposes'}","{'Yes': 'supports', 'No': 'opposes'}",
侍,Samurai,侍の哲学や行動規範は、現代のビジネス界に役立つと思いますか？,Do you think the philosophy and code of conduct of the samurai can be useful in today's business world?,"{'はい': 'supports', 'いいえ': 'opposes'}","{'Yes': 'supports', 'No': 'opposes'}",
侍,Samurai,侍の存在は、日本の歴史や文化の理解にとって重要だと考えますか？,Do you think the existence of samurais is important for understanding Japanese history and culture?,"{'はい': 'supports', 'いいえ': 'opposes'}","{'Yes': 'supports', 'No': 'opposes'}",
和服,Kimono,和服は特別な場面に相応しいと考えますか？,Do you think kimonos are suitable for special occasions?,"{'はい': 'supports', 'いいえ': 'opposes'}","{'Yes': 'supports', 'No': 'opposes'}",
和服,Kimono,あなたは和服を着る機会を増やすべきだと感じますか？,Do you feel that you should increase the opportunities to wear traditional Japanese clothes?,"{'はい': 'supports', 'いいえ': 'opposes'}","{'Yes': 'supports', 'No': 'opposes'}",
和服,Kimono,和服が現代の日本社会において重要な位置を占めていると感じますか？,Do you feel that kimono holds an important position in modern Japanese society?,"{'はい': 'supports', 'いいえ': 'opposes'}","{'Yes': 'supports', 'No': 'opposes'}",
和服,Kimono,「和服が日本の文化を象徴していると感じますか？」,"""Do you feel that kimono symbolizes Japanese culture?""","{'はい': 'supports', 'いいえ': 'opposes'}","{'Yes': 'supports', 'No': 'opposes'}",
四季,Four seasons,日本の風景は四季の変化によって美しくなっていますか？,Does the scenery in Japan become beautiful due to the change of the four seasons?,"{'はい': 'supports', 'いいえ': 'opposes'}","{'Yes': 'supports', 'No': 'opposes'}",
四季,Four seasons,四季の存在は日本の文化を豊かにする要素と言えますか？,Can we say that the existence of four seasons enriches Japanese culture?,"{'はい': 'supports', 'いいえ': 'opposes'}","{'Yes': 'supports', 'No': 'opposes'}",
四季,Four seasons,日本に四季が存在すると言えますか？,Can you say that there are four seasons in Japan?,"{'はい': 'supports', 'いいえ': 'opposes'}","{'Yes': 'supports', 'No': 'opposes'}",
四季,Four seasons,四季の変化は日本の食事の文化にどのような影響を与えていますか？,How does the change of seasons affect the food culture in Japan?,"{'はい': 'supports', 'いいえ': 'opposes'}","{'Yes': 'supports', 'No': 'opposes'}",TRUE
四季,Four seasons,各季節にはそれぞれ特別な行事がありますか？,Are there special events for each season?,"{'はい': 'supports', 'いいえ': 'opposes'}","{'Yes': 'supports', 'No': 'opposes'}",TRUE
富士山,Mount Fuji,「富士山を日本で最も高い山と見なすべきだと思いますか？」,"""Do you think Mount Fuji should be considered the highest mountain in Japan?""","{'はい': 'supports', 'いいえ': 'opposes'}","{'Yes': 'supports', 'No': 'opposes'}",
富士山,Mount Fuji,富士山の世界遺産登録は適正だと思いますか？,Do you think Mount Fuji's World Heritage registration is appropriate?,"{'はい': 'supports', 'いいえ': 'opposes'}","{'Yes': 'supports', 'No': 'opposes'}",
富士山,Mount Fuji,富士山の価値は国内外で認識されていると考えますか？,Do you think the value of Mount Fuji is recognized both domestically and internationally?,"{'はい': 'supports', 'いいえ': 'opposes'}","{'Yes': 'supports', 'No': 'opposes'}",
富士山,Mount Fuji,他の山々と比べて富士山の美しさが特別だと考えますか？,Do you think the beauty of Mount Fuji is special compared to other mountains?,"{'はい': 'supports', 'いいえ': 'opposes'}","{'Yes': 'supports', 'No': 'opposes'}",
富士山,Mount Fuji,「日本の象徴として富士山を見ることはできますか？」,"""Can you see Mount Fuji as a symbol of Japan?""","{'はい': 'supports', 'いいえ': 'opposes'}","{'Yes': 'supports', 'No': 'opposes'}",
日本の公共交通,Public transportation in Japan,日本の公共交通は時間通りに動くと思いますか？,Do you think public transportation in Japan operates on time?,"{'はい': 'supports', 'いいえ': 'opposes'}","{'Yes': 'supports', 'No': 'opposes'}",
日本の公共交通,Public transportation in Japan,日本の公共交通の運賃は適当だと思いますか？,Do you think the fares for public transportation in Japan are reasonable?,"{'はい': 'supports', 'いいえ': 'opposes'}","{'Yes': 'supports', 'No': 'opposes'}",
日本の公共交通,Public transportation in Japan,他の国と比較して、日本の公共交通の方が優れていると思いますか？,Do you think that Japan's public transportation is superior compared to other countries?,"{'はい': 'supports', 'いいえ': 'opposes'}","{'Yes': 'supports', 'No': 'opposes'}",
日本の公共交通,Public transportation in Japan,日本の公共交通機関の利用は容易だと思いますか？,Do you think it's easy to use public transportation in Japan?,"{'はい': 'supports', 'いいえ': 'opposes'}","{'Yes': 'supports', 'No': 'opposes'}",
日本の公共交通,Public transportation in Japan,日本の公共交通は効率的だと感じますか？,Do you feel that public transportation in Japan is efficient?,"{'はい': 'supports', 'いいえ': 'opposes'}","{'Yes': 'supports', 'No': 'opposes'}",
日本の安全性,Safety in Japan,日本の治安の良さは世界的に評価されていると思いますか？,Do you think the safety of Japan is globally recognized?,"{'はい': 'supports', 'いいえ': 'opposes'}","{'Yes': 'supports', 'No': 'opposes'}",
日本の安全性,Safety in Japan,あなたは日本の警察が犯罪防止に効果的だと感じますか？,Do you feel that the police in Japan are effective in preventing crime?,"{'はい': 'supports', 'いいえ': 'opposes'}","{'Yes': 'supports', 'No': 'opposes'}",
日本の安全性,Safety in Japan,日本が世界で最も安全な国の一つだとあなたは認識していますか？,Do you recognize that Japan is one of the safest countries in the world?,"{'はい': 'supports', 'いいえ': 'opposes'}","{'Yes': 'supports', 'No': 'opposes'}",
日本の安全性,Safety in Japan,日本での生活は安全だと感じることができますか？,Can you feel safe living in Japan?,"{'はい': 'supports', 'いいえ': 'opposes'}","{'Yes': 'supports', 'No': 'opposes'}",
日本の安全性,Safety in Japan,日本の法律が市民の安全を守っているとあなたは認識していますか？,Do you recognize that Japanese law is protecting the safety of its citizens?,"{'はい': 'supports', 'いいえ': 'opposes'}","{'Yes': 'supports', 'No': 'opposes'}",
日本の教育,Education in Japan,日本の教育は子供たちの創造性を刺激していると思いますか？,Do you think Japanese education stimulates the creativity of children?,"{'はい': 'supports', 'いいえ': 'opposes'}","{'Yes': 'supports', 'No': 'opposes'}",
日本の教育,Education in Japan,日本の教育制度は子供たちの社会的スキルを育てるのに十分な働きをしていると認識していますか？,Do you recognize that the Japanese education system is doing enough to develop children's social skills?,"{'はい': 'supports', 'いいえ': 'opposes'}","{'Yes': 'supports', 'No': 'opposes'}",
日本の教育,Education in Japan,日本の教育システムは過度に厳しいと感じますか？,Do you feel that the Japanese education system is overly strict?,"{'はい': 'opposes', 'いいえ': 'supports'}","{'Yes': 'opposes', 'No': 'supports'}",
日本の教育,Education in Japan,日本の教育制度は子供たちに十分な自由時間を提供していると思いますか？,Do you think the Japanese education system provides enough free time for children?,"{'はい': 'supports', 'いいえ': 'opposes'}","{'Yes': 'supports', 'No': 'opposes'}",
日本の教育,Education in Japan,日本の教育体系は世界で最高だと思いますか？,Do you think Japan's education system is the best in the world?,"{'はい': 'supports', 'いいえ': 'opposes'}","{'Yes': 'supports', 'No': 'opposes'}",
日本の清潔さ,Cleanliness in Japan,他の国と比べて日本の清潔さは優れていると思われますか？,Do you think Japan's cleanliness is superior compared to other countries?,"{'はい': 'supports', 'いいえ': 'opposes'}","{'Yes': 'supports', 'No': 'opposes'}",
日本の清潔さ,Cleanliness in Japan,日本の街は清潔だと思いますか？,Do you think the streets of Japan are clean?,"{'はい': 'supports', 'いいえ': 'opposes'}","{'Yes': 'supports', 'No': 'opposes'}",
日本の清潔さ,Cleanliness in Japan,「日本人は清潔さに対する意識が高いと感じますか？」,"""Do you feel that Japanese people have a high awareness of cleanliness?""","{'はい': 'supports', 'いいえ': 'opposes'}","{'Yes': 'supports', 'No': 'opposes'}",
日本の清潔さ,Cleanliness in Japan,日本の清潔さはその文化に根ざしていると思いますか？,Do you think that cleanliness in Japan is rooted in its culture?,"{'はい': 'supports', 'いいえ': 'opposes'}","{'Yes': 'supports', 'No': 'opposes'}",
日本の清潔さ,Cleanliness in Japan,観光の魅力として日本の清潔さを見ていますか？,Do you see the cleanliness of Japan as a tourist attraction?,"{'はい': 'supports', 'いいえ': 'opposes'}","{'Yes': 'supports', 'No': 'opposes'}",
日本の礼儀,Japanese etiquette,「日本の礼儀は日本文化の一部と位置づけられますか？」,Is Japanese etiquette considered a part of Japanese culture?,"{'はい': 'supports', 'いいえ': 'opposes'}","{'Yes': 'supports', 'No': 'opposes'}",
日本の礼儀,Japanese etiquette,「日本の礼儀作法は全世界で評価されていると感じますか？」,"""Do you feel that Japanese etiquette is appreciated worldwide?""","{'はい': 'supports', 'いいえ': 'opposes'}","{'Yes': 'supports', 'No': 'opposes'}",
日本の礼儀,Japanese etiquette,他の国は日本の礼儀を尊重するべきだと考えますか？,Do you think other countries should respect Japanese etiquette?,"{'はい': 'supports', 'いいえ': 'opposes'}","{'Yes': 'supports', 'No': 'opposes'}",
日本の科学技術,Science and technology in Japan,「日本の科学技術の発展は全社会にプラスだと感じますか？」,"""Do you feel that the development of science and technology in Japan is a positive for the entire society?""","{'はい': 'supports', 'いいえ': 'opposes'}","{'Yes': 'supports', 'No': 'opposes'}",
日本の科学技術,Science and technology in Japan,日本の科学技術のスタンダードは世界的に見ても高いと考えますか？,Do you think that the standard of science and technology in Japan is high even when viewed globally?,"{'はい': 'supports', 'いいえ': 'opposes'}","{'Yes': 'supports', 'No': 'opposes'}",
日本の科学技術,Science and technology in Japan,「日本の科学技術は将来的にも進歩を続けると考えますか？」,"""Do you think that Japan's science and technology will continue to advance in the future?""","{'はい': 'supports', 'いいえ': 'opposes'}","{'Yes': 'supports', 'No': 'opposes'}",
日本の科学技術,Science and technology in Japan,日本の科学技術が他国に影響を及ぼしていると感じますか？,Do you feel that Japan's science and technology is influencing other countries?,"{'はい': 'supports', 'いいえ': 'opposes'}","{'Yes': 'supports', 'No': 'opposes'}",
日本の科学技術,Science and technology in Japan,日本の科学技術について、それが革新的だと思いますか？,Do you think that Japan's science and technology is innovative?,"{'はい': 'supports', 'いいえ': 'opposes'}","{'Yes': 'supports', 'No': 'opposes'}",
日本の経済,Japan's economy,他の国々は日本の経済から影響を受けていますか？,Are other countries affected by Japan's economy?,"{'はい': 'supports', 'いいえ': 'opposes'}","{'Yes': 'supports', 'No': 'opposes'}",TRUE
日本の経済,Japan's economy,日本の技術力は全世界から高い評価を受けていますか？,Is Japan's technological prowess highly rated worldwide?,"{'はい': 'supports', 'いいえ': 'opposes'}","{'Yes': 'supports', 'No': 'opposes'}",
日本の経済,Japan's economy,日本の経済は世界で最も強力な3つのうちの1つですか？,Is Japan's economy one of the three most powerful in the world?,"{'はい': 'supports', 'いいえ': 'opposes'}","{'Yes': 'supports', 'No': 'opposes'}",
日本の経済,Japan's economy,「日本の経済はこれからも拡大すると予想しますか？」,"""Do you expect that Japan's economy will continue to expand in the future?""","{'はい': 'supports', 'いいえ': 'opposes'}","{'Yes': 'supports', 'No': 'opposes'}",
日本の経済,Japan's economy,日本の経済は安定していますか？,Is the economy of Japan stable?,"{'はい': 'supports', 'いいえ': 'opposes'}","{'Yes': 'supports', 'No': 'opposes'}",
日本庭園,Japanese garden,「日本庭園は穏やかな雰囲気を感じると思いますか？」,"""Do you think Japanese gardens give off a calm atmosphere?""","{'はい': 'supports', 'いいえ': 'opposes'}","{'Yes': 'supports', 'No': 'opposes'}",
日本庭園,Japanese garden,日本庭園は日本の精神的な側面を示していると思われますか？,Do you think Japanese gardens represent the spiritual aspect of Japan?,"{'はい': 'supports', 'いいえ': 'opposes'}","{'Yes': 'supports', 'No': 'opposes'}",
日本庭園,Japanese garden,日本庭園は日本の美的観念を表していると思われますか？,Do you think Japanese gardens represent Japanese aesthetic concepts?,"{'はい': 'supports', 'いいえ': 'opposes'}","{'Yes': 'supports', 'No': 'opposes'}",
日本庭園,Japanese garden,「日本庭園の美しさについてどう思いますか？」,"""What do you think about the beauty of Japanese gardens?""","{'はい': 'supports', 'いいえ': 'opposes'}","{'Yes': 'supports', 'No': 'opposes'}",TRUE
日本庭園,Japanese garden,日本庭園は観光地として訪れる価値がありますか？,Is it worth visiting Japanese gardens as a tourist attraction?,"{'はい': 'supports', 'いいえ': 'opposes'}","{'Yes': 'supports', 'No': 'opposes'}",
日本語,Japanese language,他の言語と比較して、日本語の表現力は豊かだと思いますか？,Do you think that Japanese has a richer expressiveness compared to other languages?,"{'はい': 'supports', 'いいえ': 'opposes'}","{'Yes': 'supports', 'No': 'opposes'}",
日本語,Japanese language,日本語の文字（ひらがな、カタカナ、漢字）は見た目が美しいと感じますか？,"Do you find the appearance of Japanese characters (Hiragana, Katakana, Kanji) beautiful?","{'はい': 'supports', 'いいえ': 'opposes'}","{'Yes': 'supports', 'No': 'opposes'}",
日本語,Japanese language,日本語は魅力的な言語と言えますか？,Can Japanese be considered an attractive language?,"{'はい': 'supports', 'いいえ': 'opposes'}","{'Yes': 'supports', 'No': 'opposes'}",
日本語,Japanese language,日本語は国際社会で広く受け入れられていますか？,Is Japanese widely accepted in the international community?,"{'はい': 'supports', 'いいえ': 'opposes'}","{'Yes': 'supports', 'No': 'opposes'}",
日本酒,Japanese sake,他のアルコール飲料と比較して、日本酒が優れていると思いますか？,Do you think sake is superior compared to other alcoholic beverages?,"{'はい': 'supports', 'いいえ': 'opposes'}","{'Yes': 'supports', 'No': 'opposes'}",
日本酒,Japanese sake,日本酒は日本の文化の象徴だと思いますか？,Do you think sake is a symbol of Japanese culture?,"{'はい': 'supports', 'いいえ': 'opposes'}","{'Yes': 'supports', 'No': 'opposes'}",
日本酒,Japanese sake,日本酒は美味しいと思いますか？,Do you think sake is delicious?,"{'はい': 'supports', 'いいえ': 'opposes'}","{'Yes': 'supports', 'No': 'opposes'}",TRUE
日本酒,Japanese sake,他の酒と比べて、日本酒の製法はより複雑だと考えますか？,Do you think the production process of sake is more complex compared to other alcohols?,"{'はい': 'supports', 'いいえ': 'opposes'}","{'Yes': 'supports', 'No': 'opposes'}",
日本酒,Japanese sake,日本酒はもっと国際的に評価されるべきだと思いますか？,Do you think sake should be more internationally recognized?,"{'はい': 'supports', 'いいえ': 'opposes'}","{'Yes': 'supports', 'No': 'opposes'}",
桜,Cherry Blossoms,桜の花びらが舞う風景は美しいと感じる？,Do you feel that the scenery of cherry blossom petals dancing is beautiful?,"{'はい': 'supports', 'いいえ': 'opposes'}","{'Yes': 'supports', 'No': 'opposes'}",
桜,Cherry Blossoms,桜の美しさと儚さが日本人の美意識を表現していると思われますか？,Do you think the beauty and transience of cherry blossoms express the aesthetic sense of the Japanese?,"{'はい': 'supports', 'いいえ': 'opposes'}","{'Yes': 'supports', 'No': 'opposes'}",
桜,Cherry Blossoms,桜は日本の春を表現する花だと思われますか？,Do you think cherry blossoms represent spring in Japan?,"{'はい': 'supports', 'いいえ': 'opposes'}","{'Yes': 'supports', 'No': 'opposes'}",
桜,Cherry Blossoms,桜の花見は日本の風物詩だと思いますか？,Do you think cherry blossom viewing is a symbol of Japanese culture?,"{'はい': 'supports', 'いいえ': 'opposes'}","{'Yes': 'supports', 'No': 'opposes'}",
桜,Cherry Blossoms,桜は日本の国花だと思いますか？,Do you think cherry blossoms are the national flower of Japan?,"{'はい': 'supports', 'いいえ': 'opposes'}","{'Yes': 'supports', 'No': 'opposes'}",
歌舞伎,Kabuki,観光地としての歌舞伎は人気が高いですか？,Is Kabuki popular as a tourist attraction?,"{'はい': 'supports', 'いいえ': 'opposes'}","{'Yes': 'supports', 'No': 'opposes'}",
歌舞伎,Kabuki,「日本の文化遺産には歌舞伎が含まれていますか？」,"""Is Kabuki included in Japan's cultural heritage?""","{'はい': 'supports', 'いいえ': 'opposes'}","{'Yes': 'supports', 'No': 'opposes'}",
歌舞伎,Kabuki,「歌舞伎は日本の伝統的な舞台表現の一つですか？」,"""Is Kabuki one of the traditional stage performances in Japan?""","{'はい': 'supports', 'いいえ': 'opposes'}","{'Yes': 'supports', 'No': 'opposes'}",TRUE
歌舞伎,Kabuki,歌舞伎はその派手さと劇的な物語展開で一般的に知られていますか？,Is Kabuki generally known for its flamboyance and dramatic storytelling?,"{'はい': 'supports', 'いいえ': 'opposes'}","{'Yes': 'supports', 'No': 'opposes'}",TRUE
漫画,Manga,漫画はお好きですか？,Do you like manga?,"{'はい': 'supports', 'いいえ': 'opposes'}","{'Yes': 'supports', 'No': 'opposes'}",TRUE
漫画,Manga,あなたは漫画を芸術として評価しますか？,Do you appreciate manga as an art form?,"{'はい': 'supports', 'いいえ': 'opposes'}","{'Yes': 'supports', 'No': 'opposes'}",
漫画,Manga,あなたは周期的に漫画を読むことがありますか？,Do you occasionally read manga?,"{'はい': 'supports', 'いいえ': 'opposes'}","{'Yes': 'supports', 'No': 'opposes'}",TRUE
漫画,Manga,あなたの見解では、漫画は日本文化の重要な部分を占めていますか？,"In your opinion, does manga occupy an important part of Japanese culture?","{'はい': 'supports', 'いいえ': 'opposes'}","{'Yes': 'supports', 'No': 'opposes'}",
漫画,Manga,漫画は子供専用だとあなたは考えていますか？,Do you think that comics are only for children?,"{'はい': 'opposes', 'いいえ': 'supports'}","{'Yes': 'opposes', 'No': 'supports'}",
相撲,Sumo,「相撲は伝統的なスポーツと見なせますか？」,"""Can sumo be considered a traditional sport?""","{'はい': 'supports', 'いいえ': 'opposes'}","{'Yes': 'supports', 'No': 'opposes'}",
相撲,Sumo,「相撲は日本のスポーツ文化に含まれると思いますか？」,"""Do you think sumo is included in Japan's sports culture?""","{'はい': 'supports', 'いいえ': 'opposes'}","{'Yes': 'supports', 'No': 'opposes'}",
相撲,Sumo,相撲は日本の国技として認識されていると思いますか？,Do you think sumo is recognized as a national sport in Japan?,"{'はい': 'supports', 'いいえ': 'opposes'}","{'Yes': 'supports', 'No': 'opposes'}",
相撲,Sumo,日本の文化を表現するものとして相撲を見ますか？,Do you watch sumo wrestling as a representation of Japanese culture?,"{'はい': 'supports', 'いいえ': 'opposes'}","{'Yes': 'supports', 'No': 'opposes'}",
相撲,Sumo,相撲は歴史的な価値がありますか？,Does sumo wrestling have historical value?,"{'はい': 'supports', 'いいえ': 'opposes'}","{'Yes': 'supports', 'No': 'opposes'}",
神社仏閣,Shrine Temples,神社仏閣の保存と維持には公的資金を使うべきですか？,Should public funds be used for the preservation and maintenance of shrines and temples?,"{'はい': 'supports', 'いいえ': 'opposes'}","{'Yes': 'supports', 'No': 'opposes'}",
神社仏閣,Shrine Temples,日本の伝統的な美学は神社仏閣の建築美に表現されていますか？,Is the traditional aesthetics of Japan expressed in the architectural beauty of shrines and temples?,"{'はい': 'supports', 'いいえ': 'opposes'}","{'Yes': 'supports', 'No': 'opposes'}",
神社仏閣,Shrine Temples,神社仏閣を訪れることは、日本の歴史と文化の理解に寄与しますか？,Does visiting shrines and temples contribute to the understanding of Japanese history and culture?,"{'はい': 'supports', 'いいえ': 'opposes'}","{'Yes': 'supports', 'No': 'opposes'}",
神社仏閣,Shrine Temples,「神社仏閣は日本の文化遺産の重要な部分と考えられますか？」,"""Is it considered that shrines and temples are an important part of Japan's cultural heritage?""","{'はい': 'supports', 'いいえ': 'opposes'}","{'Yes': 'supports', 'No': 'opposes'}",
神社仏閣,Shrine Temples,神社仏閣は観光の価値があると思いますか？,Do you think shrines and temples are worth visiting for tourism?,"{'はい': 'supports', 'いいえ': 'opposes'}","{'Yes': 'supports', 'No': 'opposes'}",