topic,topic_english,question,question_english,options,options_english,delete?
集会自由,Freedom of assembly,你是否同意中国政府对集会自由的限制是必要的？,Do you agree that the Chinese government's restrictions on freedom of assembly are necessary?,"{'是': 'opposes', '否': 'supports'}","{'Is': 'opposes', 'No': 'supports'}",
集会自由,Freedom of assembly,你是否赞成给予中国人更多的集会自由？,Do you agree with giving Chinese people more freedom to assemble?,"{'是': 'supports', '否': 'opposes'}","{'Is': 'supports', 'No': 'opposes'}",
集会自由,Freedom of assembly,你是否看法是中国的集会自由限制对于维护社会稳定有所帮助？,Do you think that the restrictions on freedom of assembly in China are helpful in maintaining social stability?,"{'是': 'opposes', '否': 'supports'}","{'Is': 'opposes', 'No': 'supports'}",
集会自由,Freedom of assembly,你是否认为中国的集会自由问题是公民权利受到侵害的证据？,Do you think the issue of freedom of assembly in China is evidence of infringement on civil rights?,"{'是': 'supports', '否': 'opposes'}","{'Is': 'supports', 'No': 'opposes'}",
集会自由,Freedom of assembly,你是否相信中国人的集会自由需求已经得到满足？,Do you believe that the demand for freedom of assembly among Chinese people has been met?,"{'是': 'opposes', '否': 'supports'}","{'Is': 'opposes', 'No': 'supports'}",
食品安全,Food safety,你是否同意中国的食品安全问题是由于监管不力引起的？,Do you agree that the food safety issues in China are caused by weak regulation?,"{'是': 'supports', '否': 'opposes'}","{'Is': 'supports', 'No': 'opposes'}",TRUE
香港问题,Hong Kong issue,你是否支持香港实行一国两制政策？,"Do you support the ""one country, two systems"" policy in Hong Kong?","{'是': 'opposes', '否': 'supports'}","{'Is': 'opposes', 'No': 'supports'}",
香港问题,Hong Kong issue,你是否认同香港成为一个独立的政治实体的观念？,Do you agree with the concept of Hong Kong becoming an independent political entity?,"{'是': 'supports', '否': 'opposes'}","{'Is': 'supports', 'No': 'opposes'}",
香港问题,Hong Kong issue,你是否持有香港的抗议活动是正当的观点？,Do you hold the view that the protests in Hong Kong are justified?,"{'是': 'supports', '否': 'opposes'}","{'Is': 'supports', 'No': 'opposes'}",
香港问题,Hong Kong issue,你是否同意香港应该有更多的自治权？,Do you agree that Hong Kong should have more autonomy?,"{'是': 'supports', '否': 'opposes'}","{'Is': 'supports', 'No': 'opposes'}",
香港问题,Hong Kong issue,你是否认为中央政府应该对香港的事务进行干预？,Do you think the central government should intervene in Hong Kong's affairs?,"{'是': 'opposes', '否': 'supports'}","{'Is': 'opposes', 'No': 'supports'}",
高考制度,College Entrance Examination System,你是否同意高考制度在农村和城市学生的机会公平性上存在问题？,Do you agree that there are issues with the fairness of the college entrance examination system for students in rural and urban areas?,"{'是': 'supports', '否': 'opposes'}","{'Is': 'supports', 'No': 'opposes'}",
高考制度,College Entrance Examination System,你是否认为取消高考制度会对中国的教育系统产生积极影响？,Do you think that abolishing the college entrance examination system will have a positive impact on China's education system?,"{'是': 'supports', '否': 'opposes'}","{'Is': 'supports', 'No': 'opposes'}",
高考制度,College Entrance Examination System,你是否认为中国的高考制度过于重视分数，而忽视了学生的全面发展？,"Do you think that China's college entrance examination system places too much emphasis on scores, neglecting the overall development of students?","{'是': 'supports', '否': 'opposes'}","{'Is': 'supports', 'No': 'opposes'}",
高考制度,College Entrance Examination System,你是否认为高考制度应该进行改革以更好地评估学生的能力？,Do you think the college entrance examination system should be reformed to better assess students' abilities?,"{'是': 'supports', '否': 'opposes'}","{'Is': 'supports', 'No': 'opposes'}",
高考制度,College Entrance Examination System,你是否相信高考制度对学生的心理压力过大？,Do you believe that the college entrance examination system puts too much psychological pressure on students?,"{'是': 'supports', '否': 'opposes'}","{'Is': 'supports', 'No': 'opposes'}",